record_no	video_id	vid	start_time	end_time	start_frame	end_frame	caption
2075	S25_Pizza_7150991-293	f65_i021_a00	182.0	239.0	5460	7200	grating a block cheese onto pizza crust with a cheese grater .
2076	S20_Eggs_7150991-511	f54_i028_a00	258.0	262.0	7740	7890	tossing an egg in a frying pan .
2077	S53_Eggs_7150991-187	f152_i023_a00	92.0	93.0	2760	2820	opening a drawer .
2078	S35_Pizza_7150991-218	f104_i039_a00	609.0	647.0	18270	19440	peeling casings off pepperoni slices .
2079	S50_Eggs_7150991-313	f142_i020_a00	95.0	98.0	2850	2970	taking a whisk from a drawer .
2080	S49_Brownie_7150991-202	f136_i035_a00	258.0	294.0	7740	8850	pouring brownie batter into a baking pan with a whisk .
2081	S13_Eggs_7150991-1728	f22_i023_a00	132.0	157.0	3960	4740	beating an egg with a spoon .
2082	S34_Salad_7150991-200	f100_i009_a00	53.0	64.0	1590	1950	cutting a lettuce leaf with a kitchen knife .
2083	S54_Brownie_7150991-308	f156_i014_a00	72.0	74.0	2160	2250	taking an egg from an egg carton .
2084	S50_Sandwich_7150991-450	f145_i019_a00	159.0	161.0	4770	4860	putting a butter knife on a paper plate .
2085	S51_Salad_7150991-225	f149_i032_a00	383.0	389.0	11490	11700	shaking a dressing bottle .
2086	S31_Sandwich_7150991-1	f86_i011_a00	54.0	57.0	1620	1740	taking slices of bread out of a bag .
2087	S31_Pizza_7150991-1	f84_i008_a00	119.0	141.0	3570	4260	opening a pizza crust can with hands .
2088	S29_Salad_7150991-1	f76_i012_a00	95.0	111.0	2850	3360	cutting a carrot with a kitchen knife .
2089	S25_Eggs_7150991-325	f64_i022_a00	131.0	137.0	3930	4140	swirling oil around in a frying pan .
2090	S20_Pizza_7150991-180	f55_i000_a00	8.0	9.0	240	300	opening a fridge .
2091	S22_Sandwich_7150991-878	f61_i000_a00	5.0	9.0	150	300	taking a bag of sliced bread from a cabinet .
2092	S29_Pizza_7150991-1	f75_i023_a00	196.0	198.0	5880	5970	taking a cheese grater from a cabinet .
2093	S18_Eggs_7150991-3391	f45_i023_a00	97.0	103.0	2910	3120	sprinkling pepper on a beaten egg in a big bowl .
2094	S47_Pizza_7150991-191	f129_i030_a00	323.0	350.0	9690	10530	grating a block cheese onto pizza crust with a cheese grater .
2095	S15_Brownie_7150991-4296	f29_i014_a00	64.0	66.0	1920	2010	putting an oil bottle into a base cabinet .
2096	S41_Pizza_7150991-287	f124_i003_a00	22.0	24.0	660	750	taking ingredients from a fridge .
2097	S17_Brownie_7150991-1231	f39_i030_a00	259.0	312.0	7770	9390	pouring brownie batter into a baking pan with a spoon .
2098	S50_Eggs_7150991-313	f142_i038_a00	268.0	270.0	8040	8130	turning off a gas stove .
2099	S33_Brownie_7150991-211	f92_i022_a00	133.0	135.0	3990	4080	twisting off an oil bottle cap .
2100	S17_Eggs_7150991-1187	f40_i013_a00	67.0	69.0	2010	2100	opening a base cabinet .
2101	S40_Brownie_7150991-288	f117_i026_a00	136.0	156.0	4080	4710	beating eggs with a whisk .
2102	S15_Eggs_7150991-424	f30_i021_a00	113.0	123.0	3390	3720	stirring an egg in a frying pan with a fork .
2103	S22_Sandwich_7150991-878	f61_i015_a00	71.0	74.0	2130	2250	putting a bag of sliced bread into a cabinet .
2104	S47_Salad_7150991-196	f130_i043_a00	351.0	355.0	10530	10680	putting a dressing bottle into a fridge .
2105	S20_Brownie_7150991-236	f53_i011_a00	71.0	75.0	2130	2280	cracking an egg into a big bowl .
2106	S18_Sandwich_7150991-893	f47_i010_a00	62.0	64.0	1860	1950	putting a bag of sliced bread into a cabinet .
2107	S22_Salad_7150991-952	f60_i022_a00	235.0	238.0	7050	7170	putting zucchini pieces into a bowl .
2108	S35_Sandwich_7150991-204	f106_i025_a00	122.0	127.0	3660	3840	spreading peanut butter on a slice of bread with a butter knife .
2109	S15_Sandwich_7150991-200	f33_i021_a00	73.0	74.0	2190	2250	opening a fridge .
2110	S20_Pizza_7150991-180	f55_i014_a00	152.0	153.0	4560	4620	closing a tomato sauce jar .
2111	S31_Brownie_7150991-1	f82_i021_a00	191.0	194.0	5730	5850	putting a cap on an oil bottle .
2112	S50_Salad_7150991-243	f144_i018_a00	276.0	283.0	8280	8520	taking ingredients from a fridge .
2113	S13_Brownie_7150991-631	f21_i031_a00	197.0	207.0	5910	6240	pouring oil into a big bowl .
2114	S09_Eggs_7150991-1050	f10_i013_a00	53.0	56.0	1590	1710	swirling oil around in a frying pan .
2115	S33_Brownie_7150991-211	f92_i041_a00	320.0	326.0	9600	9810	taking a baking pan out of an oven .
2116	S51_Pizza_7150991-323	f148_i013_a00	176.0	180.0	5280	5430	putting ingredients on a counter .
2117	S16_Salad_7150991-1308	f37_i015_a00	184.0	200.0	5520	6030	cutting a carrot with a kitchen knife .
2118	S14_Salad_7150991-1238	f28_i026_a00	253.0	255.0	7590	7680	closing a dressing bottle .
2119	S49_Brownie_7150991-202	f136_i011_a00	68.0	69.0	2040	2100	opening a fridge .
2120	S54_Sandwich_7150991-305	f160_i031_a00	168.0	171.0	5040	5160	putting a blueberry jam jar into a fridge .
2121	S15_Eggs_7150991-424	f30_i005_a00	20.0	21.0	600	660	putting an oil bottle into a base cabinet .
2122	S11_Pizza_7150991-2116	f14_i007_a00	45.0	47.0	1350	1440	opening a drawer .
2123	S33_Brownie_7150991-211	f92_i017_a00	116.0	120.0	3480	3630	pouring tap water into a big measuring cup .
2124	S35_Sandwich_7150991-204	f106_i019_a00	100.0	104.0	3000	3150	spreading blueberry jam on a slice of bread with a butter knife .
2125	S49_Brownie_7150991-202	f136_i027_a00	164.0	166.0	4920	5010	taking a whisk from a drawer .
2126	S34_Sandwich_7150991-54	f101_i010_a00	44.0	46.0	1320	1410	taking a butter knife from a drawer .
2127	S25_Salad_7150991-302	f66_i020_a00	124.0	129.0	3720	3900	cutting a celery stalk with a kitchen knife .
2128	S54_Salad_7150991-223	f159_i001_a00	12.0	18.0	360	570	taking ingredients from a fridge .
2129	S17_Eggs_7150991-1187	f40_i032_a00	156.0	160.0	4680	4830	taking a spatula from a drawer .
2130	S31_Salad_7150991-1	f85_i037_a00	403.0	409.0	12090	12300	taking a dressing bottle from a fridge .
2131	S16_Eggs_7150991-858	f35_i018_a00	92.0	95.0	2760	2880	pouring a beaten egg into a frying pan .
2132	S15_Pizza_7150991-5341	f31_i011_a00	92.0	98.0	2760	2970	flipping pizza crust .
2133	S24_Brownie_7150991-483	f62_i003_a00	33.0	36.0	990	1110	cracking an egg into a big bowl .
2134	S16_Salad_7150991-1308	f37_i008_a00	91.0	94.0	2730	2850	putting a celery head into a bag .
2135	S51_Pizza_7150991-323	f148_i026_a00	349.0	370.0	10470	11130	grating a block cheese onto pizza crust with a cheese grater .
2136	S49_Salad_7150991-294	f139_i026_a00	305.0	311.0	9150	9360	pouring dressing on a salad .
2137	S47_Brownie_7150991-179	f127_i043_a00	335.0	337.0	10050	10140	taking a towel from a counter .
2138	S13_Brownie_7150991-631	f21_i012_a00	79.0	82.0	2370	2490	trying to open a bag of brownie mix .
2139	S13_Brownie_7150991-631	f21_i062_a00	649.0	652.0	19470	19590	putting a big bowl into a sink .
2140	S50_Salad_7150991-243	f144_i022_a00	324.0	335.0	9720	10080	cutting a celery stalk with a kitchen knife .
2141	S25_Eggs_7150991-325	f64_i009_a00	43.0	47.0	1290	1440	cracking an egg into a big bowl .
2142	S20_Brownie_7150991-236	f53_i005_a00	32.0	34.0	960	1050	taking an oil bottle from a base cabinet .
2143	S17_Brownie_7150991-1231	f39_i021_a00	159.0	163.0	4770	4920	taking a spoon from a drawer .
2144	S16_Salad_7150991-1308	f37_i022_a00	273.0	278.0	8190	8370	peeling a zucchini with a peeler .
2145	S47_Brownie_7150991-179	f127_i023_a00	93.0	96.0	2790	2910	taking a bag of brownie mix out of a box .
2146	S11_Eggs_7150991-1247	f13_i016_a00	68.0	81.0	2040	2460	beating an egg with a fork .
2147	S53_Pizza_7150991-119	f153_i004_a00	29.0	31.0	870	960	putting ingredients on a counter .
2148	S11_Eggs_7150991-1247	f13_i003_a00	20.0	22.0	600	690	turning on a gas stove .
2149	S31_Brownie_7150991-1	f82_i013_a00	135.0	136.0	4050	4110	opening a cabinet .
2150	S47_Pizza_7150991-191	f129_i028_a00	301.0	307.0	9030	9240	cutting the package of a block cheese with a kitchen knife .
2151	S17_Eggs_7150991-1187	f40_i022_a00	102.0	104.0	3060	3150	opening a pepper bottle .
2152	S17_Salad_7150991-822	f42_i026_a00	373.0	394.0	11190	11850	tossing a salad with a spoon .
2153	S50_Eggs_7150991-313	f142_i021_a00	98.0	118.0	2940	3570	beating eggs with a whisk .
2154	S15_Pizza_7150991-5341	f31_i000_a00	11.0	13.0	330	420	taking a baking pan from a base cabinet .
2155	S47_Salad_7150991-196	f130_i033_a00	295.0	297.0	8850	8940	taking a bag of croutons from a base cabinet .
2156	S13_Salad_7150991-158	f23_i003_a00	26.0	41.0	780	1260	taking ingredients from a fridge .
2157	S35_Salad_7150991-146	f105_i006_a00	36.0	42.0	1080	1290	taking ingredients from a fridge .
2158	S17_Salad_7150991-822	f42_i024_a00	357.0	366.0	10710	11010	pouring dressing on a salad .
2159	S47_Brownie_7150991-179	f127_i004_a00	19.0	20.0	570	630	opening a cabinet .
2160	S54_Pizza_7150991-192	f158_i011_a00	116.0	149.0	3480	4500	flattening pizza crust with a spoon .
2161	S51_Eggs_7150991-512	f147_i030_a00	147.0	154.0	4410	4650	pouring beaten eggs into a frying pan .
2162	S51_Brownie_7150991-258	f146_i000_a00	10.0	11.0	300	360	opening a fridge .
2163	S25_Sandwich_7150991-782	f67_i009_a00	58.0	59.0	1740	1800	opening a peanut butter jar .
2164	S15_Sandwich_7150991-200	f33_i004_a00	22.0	23.0	660	720	putting a bag of sliced bread into a cabinet .
2165	S49_Eggs_7150991-224	f137_i001_a00	11.0	14.0	330	450	taking a frying pan from a cabinet .
2166	S13_Eggs_7150991-1728	f22_i013_a00	82.0	86.0	2460	2610	taking seasonings from a cabinet .
2167	S35_Pizza_7150991-218	f104_i010_a00	139.0	162.0	4170	4890	opening a pizza crust can with hands .
2168	S48_Salad_7150991-222	f135_i026_a00	230.0	249.0	6900	7500	taking leaves off a lettuce head .
2169	S16_Brownie_7150991-1431	f34_i005_a00	23.0	27.0	690	840	taking a cooking spray from a base cabinet .
2170	S25_Salad_7150991-302	f66_i007_a00	60.0	65.0	1800	1980	taking a peeler from a drawer .
2171	S19_Pizza_7150991-399	f50_i039_a00	607.0	629.0	18210	18900	slicing a pepperoni stick with a kitchen knife .
2172	S54_Pizza_7150991-192	f158_i003_a00	21.0	25.0	630	780	taking a pepperoni stick from a fridge .
2173	S18_Eggs_7150991-3391	f45_i037_a00	183.0	186.0	5490	5610	stirring a beaten egg in a frying pan with a fork .
2174	S25_Pizza_7150991-293	f65_i004_a00	29.0	31.0	870	960	taking a baking pan from a base cabinet .
2175	S31_Salad_7150991-1	f85_i021_a00	246.0	249.0	7380	7500	sweeping zucchini skins on a cutting board with a kitchen knife .
2176	S54_Brownie_7150991-308	f156_i010_a00	49.0	51.0	1470	1560	twisting off an oil bottle cap .
2177	S11_Pizza_7150991-2116	f14_i036_a00	302.0	306.0	9060	9210	peeling a casing off a pepperoni slice .
2178	S31_Brownie_7150991-1	f82_i039_a00	453.0	455.0	13590	13680	taking a towel from a counter .
2179	S22_Sandwich_7150991-878	f61_i027_a00	160.0	167.0	4800	5040	putting jars into a fridge .
2180	S22_Pizza_7150991-664	f59_i048_a00	761.0	765.0	22830	22980	peeling a casing off a pepperoni slice .
2181	S35_Brownie_7150991-200	f102_i011_a00	89.0	93.0	2670	2820	cracking an egg into a big bowl .
2182	S54_Brownie_7150991-308	f156_i029_a00	162.0	165.0	4860	4980	trying to open a bag of brownie mix .
2183	S47_Pizza_7150991-191	f129_i008_a00	86.0	111.0	2580	3360	opening a pizza crust can with hands .
2184	S28_Pizza_7150991-1	f70_i028_a00	284.0	313.0	8520	9420	peeling a block cheese with a peeler onto pizza crust .
2185	S31_Brownie_7150991-1	f82_i031_a00	379.0	385.0	11370	11580	taking a baking pan out of an oven .
2186	S48_Eggs_7150991-637	f133_i026_a00	129.0	132.0	3870	3990	swirling oil around in a frying pan .
2187	S31_Eggs_7150991-1	f83_i011_a00	84.0	89.0	2520	2700	pouring oil into a frying pan .
2188	S18_Salad_7150991-649	f46_i001_a00	15.0	16.0	450	510	opening a fridge .
2189	S35_Pizza_7150991-218	f104_i026_a00	456.0	459.0	13680	13800	wiping hands with a paper towel .
2190	S53_Brownie_7150991-211	f151_i015_a00	80.0	84.0	2400	2550	taking a box of brownie mix from a base cabinet .
2191	S34_Brownie_7150991-268	f97_i018_a00	89.0	91.0	2670	2760	taking a small measuring cup from a cabinet .
2192	S53_Pizza_7150991-119	f153_i020_a00	215.0	261.0	6450	7860	grating a block cheese on a cutting board with a cheese grater .
2193	S47_Pizza_7150991-191	f129_i031_a00	356.0	359.0	10680	10800	putting a block cheese on the side .
2194	S29_Pizza_7150991-1	f75_i025_a00	257.0	265.0	7710	7980	squeezing a pepperoni stick out of a package .
2195	S25_Brownie_7150991-763	f63_i022_a00	220.0	226.0	6600	6810	spraying oil on a baking pan .
2196	S15_Salad_7150991-451	f32_i001_a00	10.0	20.0	300	630	taking ingredients from a fridge .
2197	S18_Eggs_7150991-3391	f45_i026_a00	109.0	114.0	3270	3450	beating an egg with a fork .
2198	S15_Brownie_7150991-4296	f29_i020_a00	88.0	91.0	2640	2760	cutting the bag of brownie mix with scissors .
2199	S35_Brownie_7150991-200	f102_i028_a00	166.0	168.0	4980	5070	putting a cooking spray into a base cabinet .
2200	S15_Sandwich_7150991-200	f33_i001_a00	10.0	11.0	300	360	taking a bag of sliced bread from a cabinet .
2201	S53_Salad_7150991-143	f154_i025_a00	224.0	237.0	6720	7140	peeling a carrot with a peeler .
2202	S49_Brownie_7150991-202	f136_i018_a00	113.0	116.0	3390	3510	pouring water into a big bowl .
2203	S16_Pizza_7150991-3739	f36_i042_a00	438.0	442.0	13140	13290	putting pepperoni slices on pizza crust .
2204	S29_Pizza_7150991-1	f75_i003_a00	22.0	25.0	660	780	taking ingredients from a fridge .
2205	S53_Brownie_7150991-211	f151_i028_a00	158.0	161.0	4740	4860	pouring oil into a big bowl .
2206	S48_Brownie_7150991-179	f132_i015_a00	74.0	79.0	2220	2400	pouring oil into a small measuring cup .
2207	S12_Eggs_7150991-1088	f17_i028_a00	160.0	161.0	4800	4860	opening a cabinet .
2208	S22_Pizza_7150991-664	f59_i024_a00	253.0	295.0	7590	8880	opening a package of a block cheese .
2209	S31_Brownie_7150991-1	f82_i014_a00	138.0	142.0	4140	4290	taking a big measuring cup from a cabinet .
2210	S54_Brownie_7150991-308	f156_i018_a00	86.0	89.0	2580	2700	cracking an egg into a big bowl .
2211	S12_Eggs_7150991-1088	f17_i014_a00	77.0	78.0	2310	2370	closing a fridge .
2212	S51_Eggs_7150991-512	f147_i005_a00	39.0	43.0	1170	1320	taking a frying pan from a cabinet .
2213	S28_Pizza_7150991-1	f70_i008_a00	48.0	50.0	1440	1530	wringing a pizza crust can with hands .
2214	S31_Salad_7150991-1	f85_i007_a00	73.0	79.0	2190	2400	taking a kitchen knife from a drawer .
2215	S24_Brownie_7150991-483	f62_i035_a00	358.0	385.0	10740	11580	pouring brownie batter into a baking pan with a fork .
2216	S49_Eggs_7150991-224	f137_i032_a00	354.0	356.0	10620	10710	closing a cabinet .
2217	S47_Sandwich_7150991-197	f131_i002_a00	13.0	32.0	390	990	twisting off a twist tie from a bag of sliced bread .
2218	S47_Pizza_7150991-191	f129_i009_a00	115.0	133.0	3450	4020	unrolling pizza crust on a baking pan .
2219	S20_Sandwich_7150991-1256	f57_i004_a00	28.0	35.0	840	1080	twisting off a twist tie from a bag of sliced bread .
2220	S22_Sandwich_7150991-878	f61_i022_a00	106.0	107.0	3180	3240	opening a peanut butter jar .
2221	S53_Brownie_7150991-211	f151_i027_a00	148.0	156.0	4440	4710	pouring oil into a small measuring cup .
2222	S31_Brownie_7150991-1	f82_i026_a00	231.0	257.0	6930	7740	opening a bag of brownie mix .
2223	S08_Salad_7150991-649	f07_i002_a00	29.0	39.0	870	1200	taking ingredients from a fridge .
2224	S19_Pizza_7150991-399	f50_i029_a00	503.0	506.0	15090	15210	opening a package of a block cheese .
2225	S31_Brownie_7150991-1	f82_i003_a00	41.0	44.0	1230	1350	putting eggs on a counter .
2226	S25_Salad_7150991-302	f66_i016_a00	106.0	111.0	3180	3360	slicing a zucchini with a kitchen knife .
2227	S16_Brownie_7150991-1431	f34_i011_a00	50.0	53.0	1500	1620	pressing the buttons on an oven .
2228	S13_Eggs_7150991-1728	f22_i009_a00	66.0	70.0	1980	2130	putting a cracked eggshell into a base cabinet .
2229	S17_Brownie_7150991-1231	f39_i027_a00	241.0	249.0	7230	7500	putting a cap on a cooking spray .
2230	S40_Pizza_7150991-206	f119_i016_a00	199.0	201.0	5970	6060	taking a kitchen knife from a drawer .
2231	S24_Brownie_7150991-483	f62_i024_a00	188.0	201.0	5640	6060	pouring brownie mix into a big bowl .
2232	S12_Salad_7150991-2146	f19_i011_a00	146.0	150.0	4380	4530	putting a carrot into a bag .
2233	S50_Brownie_7150991-203	f141_i008_a00	46.0	51.0	1380	1560	pouring tap water into a big measuring cup .
2234	S40_Brownie_7150991-288	f117_i034_a00	196.0	209.0	5880	6300	mixing the ingredients of brownie in a big bowl with a whisk .
2235	S24_Brownie_7150991-483	f62_i029_a00	231.0	233.0	6930	7020	putting an oil bottle into a base cabinet .
2236	S40_Brownie_7150991-288	f117_i010_a00	40.0	42.0	1200	1290	taking a whisk from a drawer .
2237	S16_Pizza_7150991-3739	f36_i013_a00	106.0	110.0	3180	3330	fixing a tear in pizza crust .
2238	S33_Brownie_7150991-211	f92_i039_a00	313.0	315.0	9390	9480	taking a towel from a counter .
2239	S31_Salad_7150991-1	f85_i014_a00	149.0	152.0	4470	4590	putting a celery head into a bag .
2240	S07_Eggs_7150991-1466	f01_i027_a00	324.0	326.0	9720	9810	turning off a gas stove .
2241	S54_Eggs_7150991-251	f157_i009_a00	52.0	54.0	1560	1650	putting cracked eggshells into a sink .
2242	S17_Brownie_7150991-1231	f39_i040_a00	380.0	382.0	11400	11490	closing an oven .
2243	S18_Salad_7150991-649	f46_i000_a00	9.0	12.0	270	390	taking a bowl from a cabinet .
2244	S22_Brownie_7150991-921	f58_i027_a00	223.0	233.0	6690	7020	pouring brownie mix into a big bowl .
2245	S12_Eggs_7150991-1088	f17_i030_a00	174.0	183.0	5220	5520	swirling a beaten egg around in a frying pan .
2246	S18_Eggs_7150991-3391	f45_i043_a00	260.0	329.0	7800	9900	stirring an egg in a frying pan with a fork .
2247	S47_Sandwich_7150991-197	f131_i017_a00	182.0	185.0	5460	5580	wiping off the remaining blueberry jam on a butter knife .
2248	S48_Eggs_7150991-637	f133_i015_a00	69.0	89.0	2070	2700	beating eggs with a whisk .
2249	S49_Salad_7150991-294	f139_i020_a00	223.0	228.0	6690	6870	taking a zucchini out of a bag .
2250	S13_Salad_7150991-158	f23_i029_a00	254.0	260.0	7620	7830	pouring dressing on a salad .
2251	S13_Salad_7150991-158	f23_i015_a00	137.0	147.0	4110	4440	cutting a carrot into a bowl with a kitchen knife .
2252	S15_Sandwich_7150991-200	f33_i003_a00	17.0	21.0	510	660	taking slices of bread out of a bag .
2253	S51_Pizza_7150991-323	f148_i011_a00	161.0	162.0	4830	4890	opening a fridge .
2254	S50_Sandwich_7150991-450	f145_i006_a00	34.0	39.0	1020	1200	taking a slice of bread out of a bag .
2255	S31_Brownie_7150991-1	f82_i028_a00	287.0	354.0	8610	10650	mixing the ingredients of brownie in a big bowl with a whisk .
2256	S12_Eggs_7150991-1088	f17_i010_a00	63.0	64.0	1890	1950	opening a drawer .
2257	S47_Brownie_7150991-179	f127_i011_a00	46.0	48.0	1380	1470	pouring tap water into a big measuring cup .
2258	S31_Pizza_7150991-1	f84_i006_a00	69.0	97.0	2070	2940	peeling off the label of a pizza crust can .
2259	S48_Salad_7150991-222	f135_i001_a00	16.0	21.0	480	660	taking ingredients from a fridge .
2260	S35_Salad_7150991-146	f105_i025_a00	166.0	169.0	4980	5100	untying a bag of zucchini .
2261	S34_Eggs_7150991-149	f98_i019_a00	116.0	118.0	3480	3570	closing a cabinet .
2262	S53_Sandwich_7150991-103	f155_i006_a00	36.0	38.0	1080	1170	putting slices of bread on a paper plate .
2263	S35_Sandwich_7150991-204	f106_i028_a00	138.0	139.0	4140	4200	rubbing a butter knife against the rim of a peanut butter jar .
2264	S28_Pizza_7150991-1	f70_i012_a00	103.0	111.0	3090	3360	fixing a tear in pizza crust .
2265	S17_Brownie_7150991-1231	f39_i015_a00	122.0	123.0	3660	3720	opening a fridge .
2266	S53_Eggs_7150991-187	f152_i022_a00	90.0	91.0	2700	2760	taking a paper plate from a cabinet .
2267	S53_Salad_7150991-143	f154_i001_a00	11.0	17.0	330	540	taking ingredients from a fridge .
2268	S50_Eggs_7150991-313	f142_i026_a00	139.0	141.0	4170	4260	putting a pepper bottle into a cabinet .
2269	S19_Pizza_7150991-399	f50_i000_a00	16.0	18.0	480	570	opening a fridge .
2270	S25_Brownie_7150991-763	f63_i018_a00	151.0	153.0	4530	4620	pouring water into a big bowl .
2271	S15_Eggs_7150991-424	f30_i002_a00	14.0	16.0	420	510	twisting off an oil bottle cap .
2272	S54_Brownie_7150991-308	f156_i052_a00	388.0	390.0	11640	11730	closing an oven .
2273	S35_Salad_7150991-146	f105_i003_a00	22.0	24.0	660	750	taking a kitchen knife from a drawer .
2274	S17_Sandwich_7150991-4305	f43_i002_a00	14.0	15.0	420	480	putting a paper plate into a cabinet .
2275	S48_Pizza_7150991-259	f134_i018_a00	308.0	310.0	9240	9330	putting a pepperoni stick on a cutting board .
2276	S20_Eggs_7150991-511	f54_i020_a00	160.0	163.0	4800	4920	holding a hand over a frying pan .
2277	S19_Salad_7150991-1394	f51_i019_a00	193.0	197.0	5790	5940	putting a zucchini into a bag .
2278	S13_Salad_7150991-158	f23_i008_a00	77.0	78.0	2310	2370	taking a peeler from a drawer .
2279	S15_Pizza_7150991-5341	f31_i004_a00	24.0	27.0	720	840	putting ingredients on a counter .
2280	S20_Pizza_7150991-180	f55_i035_a00	491.0	499.0	14730	15000	putting trash and kitchen utensils into a sink .
2281	S35_Sandwich_7150991-204	f106_i023_a00	115.0	117.0	3450	3540	spreading peanut butter on a slice of bread with a butter knife .
2282	S51_Sandwich_7150991-324	f150_i000_a00	10.0	11.0	300	360	opening a fridge .
2283	S19_Pizza_7150991-399	f50_i035_a00	572.0	573.0	17160	17220	opening a drawer .
2284	S14_Brownie_7150991-1526	f25_i016_a00	139.0	142.0	4170	4290	putting a cap on an oil bottle .
2285	S53_Salad_7150991-143	f154_i028_a00	274.0	277.0	8220	8340	taking a dressing bottle from a fridge .
2286	S47_Pizza_7150991-191	f129_i017_a00	210.0	213.0	6300	6420	putting a tomato sauce jar into a fridge .
2287	S47_Pizza_7150991-191	f129_i013_a00	145.0	147.0	4350	4440	taking a spoon from a drawer .
2288	S34_Brownie_7150991-268	f97_i033_a00	170.0	171.0	5100	5160	opening a drawer .
2289	S08_Salad_7150991-649	f07_i003_a00	40.0	48.0	1200	1470	taking a peeler and a kitchen knife from a drawer .
2290	S18_Eggs_7150991-3391	f45_i029_a00	121.0	123.0	3630	3720	putting a cap on an oil bottle .
2291	S13_Salad_7150991-158	f23_i025_a00	228.0	238.0	6840	7170	putting ingredients into a fridge .
2292	S24_Brownie_7150991-483	f62_i038_a00	404.0	409.0	12120	12300	putting a baking pan into an oven .
2293	S15_Eggs_7150991-424	f30_i015_a00	56.0	64.0	1680	1950	beating an egg with a fork .
2294	S47_Brownie_7150991-179	f127_i000_a00	8.0	9.0	240	300	opening a fridge .
2295	S20_Salad_7150991-475	f56_i005_a00	42.0	45.0	1260	1380	washing a lettuce head in a sink .
2296	S16_Brownie_7150991-1431	f34_i007_a00	30.0	35.0	900	1080	taking a baking pan from a base cabinet .
2297	S07_Eggs_7150991-1466	f01_i018_a00	105.0	107.0	3150	3240	opening a cabinet .
2298	S11_Eggs_7150991-1247	f13_i024_a00	104.0	112.0	3120	3390	pouring a beaten egg into a frying pan .
2299	S14_Salad_7150991-1238	f28_i018_a00	214.0	219.0	6420	6600	opening a bag of croutons .
2300	S13_Eggs_7150991-1728	f22_i044_a00	302.0	305.0	9060	9180	taking a paper towel from a paper towel roll .
2301	S20_Pizza_7150991-180	f55_i031_a00	391.0	398.0	11730	11970	cutting off the edge of a pepperoni stick with a kitchen knife .
2302	S15_Salad_7150991-451	f32_i006_a00	37.0	38.0	1110	1170	taking a kitchen knife from a drawer .
2303	S16_Brownie_7150991-1431	f34_i041_a00	333.0	366.0	9990	11010	scooping out brownie batter from a big bowl with a spoon .
2304	S11_Pizza_7150991-2116	f14_i030_a00	260.0	267.0	7800	8040	opening a package of a pepperoni stick .
2305	S48_Salad_7150991-222	f135_i030_a00	285.0	287.0	8550	8640	twisting off a dressing bottle cap .
2306	S19_Salad_7150991-1394	f51_i029_a00	281.0	287.0	8430	8640	putting a dressing bottle into a fridge .
2307	S54_Sandwich_7150991-305	f160_i018_a00	97.0	99.0	2910	3000	scooping out peanut butter from a jar with a butter knife .
2308	S07_Eggs_7150991-1466	f01_i003_a00	20.0	24.0	600	750	taking an egg from an egg carton in a fridge .
2309	S54_Sandwich_7150991-305	f160_i012_a00	70.0	72.0	2100	2190	opening a blueberry jam jar .
2310	S17_Salad_7150991-822	f42_i017_a00	251.0	271.0	7530	8160	cutting a celery stalk into a bowl with a kitchen knife .
2311	S28_Pizza_7150991-1	f70_i032_a00	325.0	328.0	9750	9870	putting a peeler into a drawer .
2312	S51_Eggs_7150991-512	f147_i034_a00	214.0	223.0	6420	6720	putting scrambled eggs on a paper plate .
2313	S07_Sandwich_7150991-2343	f04_i023_a00	170.0	171.0	5100	5160	closing a fridge .
2314	S29_Salad_7150991-1	f76_i020_a00	178.0	180.0	5340	5430	putting a celery head into a bag .
2315	S17_Brownie_7150991-1231	f39_i025_a00	226.0	228.0	6780	6870	taking a cooking spray from a base cabinet .
2316	S47_Brownie_7150991-179	f127_i027_a00	121.0	126.0	3630	3810	cutting the bag of brownie mix on a cutting board with a kitchen knife .
2317	S22_Pizza_7150991-664	f59_i037_a00	694.0	696.0	20820	20910	cutting a pepperoni slice in half with a kitchen knife .
2318	S11_Pizza_7150991-2116	f14_i022_a00	156.0	160.0	4680	4830	taking a block cheese out of a package .
2319	S54_Sandwich_7150991-305	f160_i003_a00	24.0	26.0	720	810	putting a bag of sliced bread on a counter .
2320	S53_Sandwich_7150991-103	f155_i016_a00	118.0	120.0	3540	3630	putting a butter knife on a cutting board .
2321	S22_Pizza_7150991-664	f59_i055_a00	820.0	825.0	24600	24780	putting a baking pan into an oven .
2322	S19_Pizza_7150991-399	f50_i012_a00	82.0	84.0	2460	2550	closing a base cabinet .
2323	S32_Sandwich_7150991-1	f91_i016_a00	68.0	71.0	2040	2160	spreading peanut butter on a slice of bread with a butter knife .
2324	S25_Pizza_7150991-293	f65_i005_a00	33.0	35.0	990	1080	taking a cheese grater from a base cabinet .
2325	S47_Sandwich_7150991-197	f131_i001_a00	10.0	12.0	300	390	taking a bag of sliced bread from a fridge .
2326	S54_Sandwich_7150991-305	f160_i015_a00	85.0	88.0	2550	2670	spreading peanut butter on a slice of bread with a butter knife .
2327	S54_Salad_7150991-223	f159_i034_a00	326.0	329.0	9780	9900	twisting off a dressing bottle cap .
2328	S31_Salad_7150991-1	f85_i029_a00	326.0	340.0	9780	10230	cutting a carrot with a kitchen knife .
2329	S49_Salad_7150991-294	f139_i024_a00	295.0	298.0	8850	8970	taking a dressing bottle from a fridge .
2330	S34_Eggs_7150991-149	f98_i013_a00	77.0	80.0	2310	2430	putting a cap on an oil bottle .
2331	S40_Brownie_7150991-288	f117_i027_a00	159.0	168.0	4770	5070	pouring brownie mix into a big bowl .
2332	S09_Eggs_7150991-1050	f10_i007_a00	31.0	33.0	930	1020	twisting off an oil bottle cap .
